{
  "$schema": "./extraction-config.schema.json",
  "formationUrl": "https://formations.example.academy/mon-espace/formations/my-course",
  "mode": "chapters",
  "chapters": [
    1,
    2,
    3,
    4,
    5,
    6,
    10,
    11
  ],
  "types": [],
  "lessonIds": [],
  "rateLimit": {
    "delayMs": 2000,
    "enableRateLimit": true
  },
  "output": {
    "saveJson": true,
    "saveMarkdown": true
  },
  "filters": {
    "skipQuizzes": true,
    "skipAncChapters": true,
    "allowedTypes": ["📚", "✍️", "📔", "🧠", "🔥"]
  },
  "media": {
    "skipMedia": false,
    "skipTranscribe": false,
    "skipScreenshots": false
  },
  "proxy": {
    "enabled": false,
    "url": "http://127.0.0.1:9090"
  },
  "antiDetection": {
    "enableRandomJitter": true,
    "exponentialBackoff": true,
    "circuitBreakerThreshold": 5,
    "customHeaders": {
      "acceptLanguage": "fr-FR,fr;q=0.9,en;q=0.8"
    }
  },
  "dryRun": true
}
